Topic,Sub-topic,Text,Stance
בריאות ורווחה_מתנגד,שביתת רופאים,רופאים צריכים למצוא דרכים אחרות להביע את מחאתם מבלי לפגוע באנשים.,מתנגד
בריאות ורווחה_מתנגד,שביתת רופאים,הדרישות של הרופאים בשטחים מסוימים הן לא סבירות ואין להם זכות לפגוע באחרים.,מתנגד
בריאות ורווחה_מתנגד,שביתת רופאים,מהלך כגון שביתה לא מקבל תמיכה ציבורית כאשר הוא משפיע על חיי האזרחים.,מתנגד
בריאות ורווחה_מתנגד,שביתת רופאים,"בעצם, השביתה רק יוצר מתיחות בין רופאים לבין מטופלים.",מתנגד
בריאות ורווחה_מתנגד,שביתת רופאים,"מאבק דרך שביתה לא רק שלא פותר בעיות, אלא יכול להחמיר אותן.",מתנגד
בריאות ורווחה_מתנגד,שביתת רופאים,שביתת רופאים מספקת אפקט שלילי בטווח הקצר ובטח בעידן של קורונה.,מתנגד
בריאות ורווחה_מתנגד,שביתת רופאים,לא ניתן לקבל שהרופאים שמים את האינטרסים האישיים שלהם מעל הבריאות הציבורית.,מתנגד
בריאות ורווחה_נייטרלי,שביתת רופאים,שביתת רופאים היא תופעה שהתרחשה פעמים רבות בעבר.,נייטרלי
בריאות ורווחה_נייטרלי,שביתת רופאים,הרופאים טוענים שהשביתות עשויות להביא לתשומת לב לצרכים שלהם.,נייטרלי
בריאות ורווחה_נייטרלי,שביתת רופאים,במערכת הבריאות יש לעיתים קרובות עימותים בין רופאים לבין הממשלה.,נייטרלי
בריאות ורווחה_נייטרלי,שביתת רופאים,יש המעריכים כי שביתות רפואיות משפיעות על מערכת הבריאות באופן שונה.,נייטרלי
בריאות ורווחה_נייטרלי,שביתת רופאים,נראה שהשביתה יכולה להעלות את המודעות לבעיות בתנאי העבודה.,נייטרלי
בריאות ורווחה_נייטרלי,שביתת רופאים,"בהיסטוריה, שכיחות שביתות רופאים שונה ממדינה למדינה.",נייטרלי
בריאות ורווחה_נייטרלי,שביתת רופאים,כבר קרו מקרים בעבר בהם רופאים יצאו לשביתות בשל התנאים הקיימים.,נייטרלי
בריאות ורווחה_נייטרלי,שביתת רופאים,השביתה יכולה להוות כלי לגיטימי להביע מחאה.,נייטרלי
בריאות ורווחה_נייטרלי,שביתת רופאים,המדיומים מציגים לעיתים את עמדותיהם של הרופאים בשביתה.,נייטרלי
בריאות ורווחה_נייטרלי,שביתת רופאים,וודאי שיש לקיים דיון בנושא זה במשרד הבריאות.,נייטרלי
בריאות ורווחה_תומך,ביטוח בריאות ממלכתי,ביטוח בריאות ממלכתי מבטיח גישה לשירותי רפואה בסיסיים לכל הלכה.,תומך
בריאות ורווחה_תומך,ביטוח בריאות ממלכתי,מערכת הבריאות הציבורית מאפשרת לאנשים לקבל טיפול רפואי בלי חשש מבעיות כלכליות.,תומך
בריאות ורווחה_תומך,ביטוח בריאות ממלכתי,חוק ביטוח הבריאות הממלכתי מסייע להפחית את העלויות הרפואיות עבור האזרחים.,תומך
בריאות ורווחה_תומך,ביטוח בריאות ממלכתי,ביטוח בריאות ממלכתי מקנה לכל אחד את הזכות לקבל טיפול רפואי נחוץ.,תומך
בריאות ורווחה_תומך,ביטוח בריאות ממלכתי,יוזמות בתחום הבריאות הציבורית הוכיחו את יעילותן בהגנה על בריאות הציבור.,תומך
בריאות ורווחה_תומך,ביטוח בריאות ממלכתי,ביטוח בריאות ממלכתי עוזר בפיקוח על מחירי התרופות והשירותים הרפואיים.,תומך
בריאות ורווחה_תומך,ביטוח בריאות ממלכתי,שירותי הבריאות הממלכתיים הם ממלכתיים וכוללים מגוון רחב של טיפולים.,תומך
בריאות ורווחה_תומך,ביטוח בריאות ממלכתי,"כל אדם זכאי לטיפול רפואי הולם, וזוהי אחת התועלות הגדולות של הביטוח הציבורי.",תומך
בריאות ורווחה_תומך,ביטוח בריאות ממלכתי,הביטוח הממלכתי מפחית את העומס הכלכלי על משפחות רבות במדינה.,תומך
בריאות ורווחה_תומך,ביטוח בריאות ממלכתי,תוכנית הביטוח הבריאותי מציעה הגנה בעת מחלה ולא רואה בעין את יכולת התשלום.,תומך
בריאות ורווחה_מתנגד,ביטוח בריאות ממלכתי,ביטוח הבריאות הממלכתי לא מצליח לספק את הצרכים האישיים של כל אזרח.,מתנגד
בריאות ורווחה_מתנגד,ביטוח בריאות ממלכתי,"חלק מהשירותים הרפואיים אינם מכוסים על ידי הביטוח הממלכתי, leaving patients without options.",מתנגד
בריאות ורווחה_מתנגד,ביטוח בריאות ממלכתי,ישנם טענות רבות על התורים הארוכים בשירותי הבריאות הציבוריים.,מתנגד
בריאות ורווחה_מתנגד,ביטוח בריאות ממלכתי,ביטוח בריאות ממלכתי יכול להפוך לסבך בירוקרטי שפוגע במטפלים ובמטופלים כאחד.,מתנגד
בריאות ורווחה_מתנגד,ביטוח בריאות ממלכתי,יש מומחים שטוענים שהמערכת הציבורית מפחיתה את איכות השירותים הרפואיים.,מתנגד
בריאות ורווחה_מתנגד,ביטוח בריאות ממלכתי,המחסור במומחים בתחומים מסוימים במערכת הבריאות הציבורית הוא בעיה חמורה.,מתנגד
בריאות ורווחה_מתנגד,ביטוח בריאות ממלכתי,כשלי ניהול בביטוח הבריאות הממלכתי גורמים לאי-נוחות רבה בקרב המטופלים.,מתנגד
בריאות ורווחה_מתנגד,ביטוח בריאות ממלכתי,"לא כל התרופות מכוסות בביטוח, מה שעלול להותיר רבים במצב קשה.",מתנגד
בריאות ורווחה_מתנגד,ביטוח בריאות ממלכתי,קריטריונים רפואיים לעיתים קרובות לא מספקים טיפול מיידי במקרי חירום.,מתנגד
בריאות ורווחה_מתנגד,ביטוח בריאות ממלכתי,חלק מהאנשים מעדיפים ביטוח פרטי בגלל היתרונות הרבים שהוא מציע.,מתנגד
בריאות ורווחה_נייטרלי,ביטוח בריאות ממלכתי,ביטוח בריאות ממלכתי הוא נושא שמעסיק את החברה בשנים האחרונות.,נייטרלי
בריאות ורווחה_נייטרלי,ביטוח בריאות ממלכתי,"המערכת הבריאותית בישראל מורכבת ממסלולים שונים, כולל ציבוריים ופרטיים.",נייטרלי
בריאות ורווחה_נייטרלי,ביטוח בריאות ממלכתי,תהליך קביעת מדיניות הבריאות כולל רגולציות רבות ותשומת לב ממספר גורמים.,נייטרלי
בריאות ורווחה_נייטרלי,ביטוח בריאות ממלכתי,"ביטוח בריאות ממלכתי לא חריג במדינות אחרות, ורבים מיישמים מודלים דומים.",נייטרלי
בריאות ורווחה_נייטרלי,ביטוח בריאות ממלכתי,כל התקדמות בתחום הבריאות הציבורית עשויה להשפיע על המערכת כולה.,נייטרלי
בריאות ורווחה_נייטרלי,ביטוח בריאות ממלכתי,יש גורמים מסוימים המעדיפים להתמקד בשיפור השירותים הציבוריים על פני ביטוח פרטי.,נייטרלי
בריאות ורווחה_נייטרלי,ביטוח בריאות ממלכתי,אי אזרחות או מעמדו של אדם עשויים להשפיע על גישתו לשירותי הבריאות.,נייטרלי
בריאות ורווחה_נייטרלי,ביטוח בריאות ממלכתי,המערכת לבריאות הציבורית מתמודדת עם אתגרים משמעותיים במציאות המשתנה.,נייטרלי
בריאות ורווחה_נייטרלי,ביטוח בריאות ממלכתי,"ביטוח בריאות ממלכתי הוא נושא שנוגע לכולנו, והדעות עליו חלוקות.",נייטרלי
בריאות ורווחה_נייטרלי,ביטוח בריאות ממלכתי,נראה שעדיין קיימת חקירה רבה בנושא הביטוח הבריאותי והשפעתו על האזרח.,נייטרלי
בריאות ורווחה_תומך,הבטחת הכנסה,הבטחת ההכנסה מספקת תוכנית חשובה לתמיכה באנשים שמתקשים למצוא עבודה.,תומך
בריאות ורווחה_תומך,הבטחת הכנסה,תמיכה כלכלית מינימלית היא חובה במדינה מתקדמת כמו שלנו.,תומך
בריאות ורווחה_תומך,הבטחת הכנסה,התוכנית עוזרת לצמצם את העוני ולקדם רווחה חברתית.,תומך
בריאות ורווחה_תומך,הבטחת הכנסה,סיוע כלכלי למי שאין פתרון תעסוקתי הוא חיוני לבריאות הכלכלה.,תומך
בריאות ורווחה_תומך,הבטחת הכנסה,אנשים שמקבלים הבטחת הכנסה יכולים להתפנות לחפש עבודה מבלי לדאוג לקיום הבסיסי שלהם.,תומך
בריאות ורווחה_תומך,הבטחת הכנסה,הבטחת הכנסה היא דרך להילחם בעוני ולעזור למשפחות להשתקם.,תומך
בריאות ורווחה_תומך,הבטחת הכנסה,בירור שפע של אנשים מצא פתרונות מעשיים טובים יותר בעזרת ההבטחה כלכלית.,תומך
בריאות ורווחה_תומך,הבטחת הכנסה,אני מאמין שהבטחת הכנסה היא דרך נכונה לסייע לשכבות חלשות בחברה.,תומך
בריאות ורווחה_תומך,הבטחת הכנסה,"ככל שאנחנו תומכים במעמד הנמוך, כך החברה שלנו כולה מתפקדת טוב יותר.",תומך
בריאות ורווחה_תומך,הבטחת הכנסה,להבטחת הכנסה יש תוצאות חיוביות על תחושת הביטחון של אזרחים רבים.,תומך
בריאות ורווחה_מתנגד,הבטחת הכנסה,הבטחת הכנסה יכולה לגרום לתלות כלכלית ולעכב חיפוש עבודה.,מתנגד
בריאות ורווחה_מתנגד,הבטחת הכנסה,המשאבים המוקצים להבטחת הכנסה עשויים להיות מופנים טוב יותר לתוכניות הכשרה מקצועית.,מתנגד
בריאות ורווחה_מתנגד,הבטחת הכנסה,תוכנית זו עלולה ליצור עיוותים בשוק העבודה ולייצר תמריצים שגויים.,מתנגד
בריאות ורווחה_מתנגד,הבטחת הכנסה,אני סבור שהמדינה לא צריכה לממן אורח חיים לכל מי שלא עובד.,מתנגד
בריאות ורווחה_מתנגד,הבטחת הכנסה,הבטחת הכנסה לא מתמרצת עובדים ומעודדת שכחה עצמית.,מתנגד
בריאות ורווחה_מתנגד,הבטחת הכנסה,"מניסיוני, האנשים שמקבלים הבטחת הכנסה לעיתים לא ממצים את הפוטנציאל שלהם.",מתנגד
בריאות ורווחה_מתנגד,הבטחת הכנסה,העדר עבודה ולקיחת ההבטחה עלולה לפגוע בתחושת הערך העצמי של אדם.,מתנגד
בריאות ורווחה_מתנגד,הבטחת הכנסה,"שיטה זו אינה פותרת בעיות כלכליות אמיתיות, אלא רק מסמנת פצע פתוח.",מתנגד
בריאות ורווחה_מתנגד,הבטחת הכנסה,לא ניתן לבנות חברה בריאה על תשלום לאנשים שלא תורמים לכלכלה.,מתנגד
בריאות ורווחה_מתנגד,הבטחת הכנסה,הבטחת הכנסה יכולה להוביל לבעיות כלכליות נוספות בטווח הארוך.,מתנגד
בריאות ורווחה_נייטרלי,הבטחת הכנסה,"יש מי שסבורים שהבטחת הכנסה היא צעד נכון, ויש המפקפקים בכך.",נייטרלי
בריאות ורווחה_נייטרלי,הבטחת הכנסה,האם ההבטחה הזו אכן מועילה או לא זה נושא לדיון רציני.,נייטרלי
בריאות ורווחה_נייטרלי,הבטחת הכנסה,"הממשלה מציעה תוכניות שונות, אחת מהן היא הבטחת הכנסה.",נייטרלי
בריאות ורווחה_נייטרלי,הבטחת הכנסה,חלק מהאנשים מקבלים את ההבטחה וחלקם מעדיפים למצוא עבודה.,נייטרלי
בריאות ורווחה_נייטרלי,הבטחת הכנסה,נתוני המחקרים בנוגע להבטחת הכנסה מצביעים על תוצאות מעורבות.,נייטרלי
בריאות ורווחה_נייטרלי,הבטחת הכנסה,הבטחת הכנסה היא חלק מהמערכת החברתית המורכבת בישראל.,נייטרלי
בריאות ורווחה_נייטרלי,הבטחת הכנסה,הדיון סביב הבטחת הכנסה ממשיך לעורר שאלות רבות.,נייטרלי
בריאות ורווחה_נייטרלי,הבטחת הכנסה,הרקע החברתי והכלכלי במדינה משפיע על עמדות בנוגע להבטחת הכנסה.,נייטרלי
בריאות ורווחה_נייטרלי,הבטחת הכנסה,"ישנם תומכים ומתנגדים לתוכנית זו, ואין מדע חד משמעי בנושא.",נייטרלי
בריאות ורווחה_נייטרלי,הבטחת הכנסה,"ההבטחה הזו מגיעה בצורות שונות במדינות שונות, וכל מדינה מוצאת את הדרך שלה להתמודדות עם בעיות כלכליות.",נייטרלי
בריאות ורווחה_תומך,רפואה פרטית,רפואה פרטית מאפשרת גישה מהירה למומחים.,תומך
בריאות ורווחה_תומך,רפואה פרטית,בקליניקות פרטיות יש לרוב שירותים ברמה גבוהה יותר.,תומך
בריאות ורווחה_תומך,רפואה פרטית,בשירותי רפואה פרטית ניתן לקבל טיפול מותאם אישית.,תומך
בריאות ורווחה_תומך,רפואה פרטית,רפואה פרטית מפחיתה את זמני ההמתנה לקבלת טיפול.,תומך
בריאות ורווחה_תומך,רפואה פרטית,רבים מעדיפים רפואה פרטית בשל הגמישות בשעות הטיפול.,תומך
בריאות ורווחה_תומך,רפואה פרטית,איכות השירותים במערכת הבריאות הפרטית בדרך כלל גבוהה.,תומך
בריאות ורווחה_תומך,רפואה פרטית,הניסיון במערכת הבריאות הפרטית יכול להשפיע לטובה על התוצאות הרפואיות.,תומך
בריאות ורווחה_תומך,רפואה פרטית,לקוחות רבים חווים חוויות חיוביות ומרגיעות במרפאות פרטיות.,תומך
בריאות ורווחה_תומך,רפואה פרטית,הרפואה הפרטית מציעה טכנולוגיות חדשות ושיטות טיפול מתקדמות.,תומך
בריאות ורווחה_תומך,רפואה פרטית,רפואה פרטית יכולה להיות פתרון מצוין למי שמחפש טיפול איכותי ומיוחד.,תומך
בריאות ורווחה_מתנגד,רפואה פרטית,רפואה פרטית עשויה ליצור הבדל גדול בקבלת טיפול בין עשירים לעניים.,מתנגד
בריאות ורווחה_מתנגד,רפואה פרטית,התקדמות למדינה עם מערכת בריאות פרטית עלולה להחמיר את הפערים החברתיים.,מתנגד
בריאות ורווחה_מתנגד,רפואה פרטית,יש שמזדהים עם התפיסה כי רפואה פרטית לא אמורה להחליף רפואה ציבורית.,מתנגד
בריאות ורווחה_מתנגד,רפואה פרטית,מחירי הטיפולים הפרטיים יכולים להיות גבוהים מאוד ולייצר עול כלכלי.,מתנגד
בריאות ורווחה_מתנגד,רפואה פרטית,לא תמיד השירותים הפרטיים מבטיחים תוצאות טובות יותר מאשר ברפואה ציבורית.,מתנגד
בריאות ורווחה_מתנגד,רפואה פרטית,יש המוטרדים מהמחשבה שבריאות היא עסק ולא זכות בסיסית.,מתנגד
בריאות ורווחה_מתנגד,רפואה פרטית,רבים חוששים שחברות הביטוח יגבו יותר על טיפולים פרטיים.,מתנגד
בריאות ורווחה_מתנגד,רפואה פרטית,המקצועיות של רופאים במערכת הפרטית עשויה להיות מפוקפקת לעיתים.,מתנגד
בריאות ורווחה_מתנגד,רפואה פרטית,הקפיצה לרפואה פרטית עשויה להוביל לפתרונות לא קבועים או שטחיים.,מתנגד
בריאות ורווחה_מתנגד,רפואה פרטית,לא לכולם יש את האפשרות הכלכלית לבחור ברפואה פרטית.,מתנגד
בריאות ורווחה_נייטרלי,רפואה פרטית,רפואה פרטית קיימת במקביל למערכת הבריאות הציבורית.,נייטרלי
בריאות ורווחה_נייטרלי,רפואה פרטית,אנשים שונים בוחרים בשיטות רפואיות שונות בהתאם לצרכים שלהם.,נייטרלי
בריאות ורווחה_נייטרלי,רפואה פרטית,במערכת הבריאות הפרטית יש מגוון רחב של טיפולים.,נייטרלי
בריאות ורווחה_נייטרלי,רפואה פרטית,יש המעדיפים רפואה פרטית בגלל חוויות קודמות עם המערכת הציבורית.,נייטרלי
בריאות ורווחה_נייטרלי,רפואה פרטית,מידע על רפואה פרטית נפוץ יותר באינטרנט בשנים האחרונות.,נייטרלי
בריאות ורווחה_נייטרלי,רפואה פרטית,יש המצביעים על היתרונות של רפואה פרטית במצבים מסוימים.,נייטרלי
בריאות ורווחה_נייטרלי,רפואה פרטית,פטנטים חדשים ברפואה פרטית עשויים לשפר את איכות החיים.,נייטרלי
בריאות ורווחה_נייטרלי,רפואה פרטית,"כשמדובר בטיפול רפואי, ההעדפות יכולות להיות אישיות מאוד.",נייטרלי
בריאות ורווחה_נייטרלי,רפואה פרטית,עבודת צוות בשירותי רפואה פרטית יכולה להבדיל בין טיפולים.,נייטרלי
בריאות ורווחה_נייטרלי,רפואה פרטית,המרפאות הפרטיות מציעות לרוב שירותים בתחום הבריאות המשלימה.,נייטרלי
בריאות ורווחה_תומך,שירותי רווחה,שירותי הרווחה מסייעים לאנשים להתמודד עם קשיים כלכליים ונפשיים.,תומך
בריאות ורווחה_תומך,שירותי רווחה,עמותות רבות מספקות מענה יעיל באמצעות שירותי רווחה לקהילה.,תומך
בריאות ורווחה_תומך,שירותי רווחה,תוכניות לשיקום נפגעי טראומה מציעות שירותים חיוניים לשיפור איכות החיים.,תומך
בריאות ורווחה_תומך,שירותי רווחה,שירותי הרווחה נותנים תמיכה משפחתית לחיים פעילים ומסייעים בשימור קשרים חברתיים.,תומך
בריאות ורווחה_תומך,שירותי רווחה,המדינה צריכה להשקיע יותר בשירותי רווחה כדי לעזור לאוכלוסיות חלשות.,תומך
בריאות ורווחה_תומך,שירותי רווחה,שירותי רווחה מאפשרים לאנשים לחיות בכבוד גם במצבים קשים.,תומך
בריאות ורווחה_תומך,שירותי רווחה,אנשים רבים מצאו בשירותי הרווחה את התמיכה הדרושה כדי להתגבר על קשיים.,תומך
בריאות ורווחה_תומך,שירותי רווחה,"העובדים בשירותי הרווחה הם מקצועיים ומסורים, ועושים עבודתם במסירות רבה.",תומך
בריאות ורווחה_תומך,שירותי רווחה,תמיכה נפשית במסגרת שירותי הרווחה יכולה לשנות חיים של אנשים.,תומך
בריאות ורווחה_תומך,שירותי רווחה,שירותי הרווחה מהווים נדבך חשוב בחברה בריאה ומאוחדת.,תומך
בריאות ורווחה_מתנגד,שירותי רווחה,שירותי הרווחה לא תמיד מצליחים לספק את התמיכה הנדרשת לאנשים.,מתנגד
בריאות ורווחה_מתנגד,שירותי רווחה,"לעיתים, שירותי הרווחה נתפסים כלא יעילים וחסרי ערך ממשי.",מתנגד
בריאות ורווחה_מתנגד,שירותי רווחה,במקרים רבים יש סיכון לפקשוט פולשני של שירותי הרווחה בחיים הפרטיים.,מתנגד
בריאות ורווחה_מתנגד,שירותי רווחה,יש טוענים ששירותי הרווחה עלולים לעודד תעוזה במקום להציע פתרונות אמיתיים.,מתנגד
בריאות ורווחה_מתנגד,שירותי רווחה,שירותי הרווחה לפעמים לא עומדים בציפיות הציבור ולעיתים גורמים יותר נזק מתועלת.,מתנגד
בריאות ורווחה_מתנגד,שירותי רווחה,"לא כל העובדים בשירותי הרווחה הם מקצועיים, וזה פוגע באיכות השירות.",מתנגד
בריאות ורווחה_מתנגד,שירותי רווחה,יש המכתיעים את שירותי הרווחה בכך שכאבם של אנשים מתמשכים למרות העזרה.,מתנגד
בריאות ורווחה_מתנגד,שירותי רווחה,שירותי הרווחה לא תמיד מתאימים לצרכים האישיים של כל אדם.,מתנגד
בריאות ורווחה_מתנגד,שירותי רווחה,לא אחת אנו עדים למקרה שבו שירותי הרווחה כפו פתרונות שלא התאימו למציאות של אנשים.,מתנגד
בריאות ורווחה_מתנגד,שירותי רווחה,אולי עלינו לשקול אלטרנטיבות אחרות במקום להסתמך רק על שירותי הרווחה.,מתנגד
בריאות ורווחה_נייטרלי,שירותי רווחה,שירותי הרווחה קיימים במדינות רבות ברחבי העולם.,נייטרלי
בריאות ורווחה_נייטרלי,שירותי רווחה,נראה כי ישנם מגוון שירותים שמוצעים על ידי הרווחה לציבור.,נייטרלי
בריאות ורווחה_נייטרלי,שירותי רווחה,יש דרכים שונות שבהן ניתן לקבל סיוע משירותי הרווחה.,נייטרלי
בריאות ורווחה_נייטרלי,שירותי רווחה,"חלק מהאנשים רוצים לנצל את השירותים, בעוד אחרים לא תרמו לכך.",נייטרלי
בריאות ורווחה_נייטרלי,שירותי רווחה,מידע על שירותי רווחה פורסם בעיתונים ובאתרי חדשות רבים.,נייטרלי
בריאות ורווחה_נייטרלי,שירותי רווחה,שירותי הרווחה מציעים מגוון רחב של תוכניות וסיוע.,נייטרלי
בריאות ורווחה_נייטרלי,שירותי רווחה,"לאחרונה, התקיימה ישיבה לדיון בשירותי הרווחה בישראל.",נייטרלי
בריאות ורווחה_נייטרלי,שירותי רווחה,השפעת שירותי הרווחה משתנה מאדם לאדם על פי צרכיו.,נייטרלי
בריאות ורווחה_נייטרלי,שירותי רווחה,שאלות רבות נשאלות לגבי היעילות של שירותי הרווחה.,נייטרלי
בריאות ורווחה_נייטרלי,שירותי רווחה,בקרב הציבור יש שמועות שונות על שירותי הרווחה.,נייטרלי
