Topic,Sub-topic,Text,Stance
דת ומדינה_תומך,לימודי יהדות,לימודי יהדות תורמים לפיתוח תרבותי ואומנותי ייחודי.,תומך
דת ומדינה_מתנגד,לימודי יהדות,מדובר בהשקעה מיותרת בזמן ובמשאבים.,מתנגד
דת ומדינה_מתנגד,לימודי יהדות,לימוד יהדות יכול להוביל ליצירת מחסומים בין דתיים לחילוניים.,מתנגד
דת ומדינה_מתנגד,לימודי יהדות,נראה שלימודי יהדות לא ממלאים את הצרכים של רוב התלמידים.,מתנגד
דת ומדינה_מתנגד,לימודי יהדות,ההתמקדות בהיסטוריה יהודית עלולה לשכוח את תרבויות אחרות.,מתנגד
דת ומדינה_מתנגד,לימודי יהדות,יש שטוענים כי לימודי יהדות מעלים יותר שאלות מאשר תשובות.,מתנגד
דת ומדינה_מתנגד,לימודי יהדות,לא לכל התלמידים יש את העניין או המוטיבציה ללימודים אלה.,מתנגד
דת ומדינה_מתנגד,לימודי יהדות,המסגרת הדתית יכולה להוביל לקונפליקטים בין תלמידים.,מתנגד
דת ומדינה_מתנגד,לימודי יהדות,יש ספקות לגבי הרלוונטיות של לימודי יהדות בעידן המודרני.,מתנגד
דת ומדינה_מתנגד,לימודי יהדות,לימודי יהדות עשויים להיות מסוכנים מבחינת חינוך פתוח ומגוון.,מתנגד
דת ומדינה_מתנגד,לימודי יהדות,"באופן כללי, הדברים שנלמדים לא עומדים בקנה אחד עם השקפות חילוניות.",מתנגד
דת ומדינה_נייטרלי,לימודי יהדות,לימודי יהדות קיימים במוסדות חינוך שונים.,נייטרלי
דת ומדינה_נייטרלי,לימודי יהדות,"חלק מהתלמידים נהנים ללמוד על יהדות, בעוד אחרים לא.",נייטרלי
דת ומדינה_נייטרלי,לימודי יהדות,נראה שיש ביקוש בלימודי יהדות במערכות החינוך.,נייטרלי
דת ומדינה_נייטרלי,לימודי יהדות,נושאי לימודי יהדות משתנים בין מוסדות שונים.,נייטרלי
דת ומדינה_נייטרלי,לימודי יהדות,אזורים שונים במדינה מתייחסים ללימודי יהדות בדרכים שונות.,נייטרלי
דת ומדינה_נייטרלי,לימודי יהדות,לא כל התלמידים משתתפים באותם שיעורים בלימודי יהדות.,נייטרלי
דת ומדינה_נייטרלי,לימודי יהדות,בבתי ספר מסוימים יש דגש על לימודי יהדות ובאחרים לא.,נייטרלי
דת ומדינה_נייטרלי,לימודי יהדות,"יש המון ספרים על יהדות, חלקם פופולריים מאוד.",נייטרלי
דת ומדינה_נייטרלי,לימודי יהדות,"לימודי יהדות כולל מגוון של נושאים כמו היסטוריה, תרבות ודת.",נייטרלי
דת ומדינה_נייטרלי,לימודי יהדות,חלק מהתלמידים פוגשים במושגים יהודיים רק בשיעורי חינוך.,נייטרלי
דת ומדינה_תומך,שוויון בנטל,שוויון בנטל הוא עקרון יסוד במדינה דמוקרטית שצורך מחויבות של כולם.,תומך
דת ומדינה_תומך,שוויון בנטל,הצורך בשוויון בנטל מומלצה כדי למנוע תחושות של תסכול בקרב אזרחים.,תומך
דת ומדינה_תומך,שוויון בנטל,כל אחד צריך לתרום לפי יכולותיו ולא להיות פטור בגלל מעמדו או מצב משפחתי.,תומך
דת ומדינה_תומך,שוויון בנטל,שוויון בנטל מבטיח שכולנו נושאים בעול החברה בצורה הוגנת.,תומך
דת ומדינה_תומך,שוויון בנטל,אזרח שברח מהצבא לא צריך להיות מעל האחרים ששרתו את המדינה.,תומך
דת ומדינה_תומך,שוויון בנטל,"אם לא נייצר שוויון בנטל, נמשיך להעמיק את הפערים החברתיים.",תומך
דת ומדינה_תומך,שוויון בנטל,שירות צבאי או טכנולוגי הוא חובתנו כלפי המדינה והנוכחות שלנו מתבקשת.,תומך
דת ומדינה_תומך,שוויון בנטל,"כדי לבנות חברה טובה יותר, על כולנו לשרת באותה המידה.",תומך
דת ומדינה_תומך,שוויון בנטל,"המדינה תלויה בכולם, ולכן תפקידנו לתמוך בשוויון בנטל.",תומך
דת ומדינה_תומך,שוויון בנטל,לשירות שוויוני יש השפעה חיובית על תחושת השייכות של צעירים במדינה.,תומך
דת ומדינה_מתנגד,שוויון בנטל,שוויון בנטל עלול להוביל להעדפה לאנשים שאינם מתאימים לשירות.,מתנגד
דת ומדינה_מתנגד,שוויון בנטל,לא ניתן להשוות בין חובות של אזרחים שונים בעקבות סיבות חברתיות וכלכליות.,מתנגד
דת ומדינה_מתנגד,שוויון בנטל,יש להביא בחשבון את התנאים האישיים והמשפחתיים של כל אדם לפני שמטילים עליו נטל.,מתנגד
דת ומדינה_מתנגד,שוויון בנטל,כפייה של שוויון בנטל יכולה לגרום למרמור ולהתנגדות מצד אוכלוסיות מסוימות.,מתנגד
דת ומדינה_מתנגד,שוויון בנטל,"לא כולם צריכים לשרת בצבא, במיוחד כשנראה שיש להם תפקידים חשובים במקום אחר.",מתנגד
דת ומדינה_מתנגד,שוויון בנטל,שוויון בנטל לא מביא לידי ביטוי את המציאות המורכבת של החיים בישראל.,מתנגד
דת ומדינה_מתנגד,שוויון בנטל,ישנן אוכלוסיות שבהן לא ניתן ליישם שוויון בנטל מבלי לפגוע במי שאינו מסוגל.,מתנגד
דת ומדינה_מתנגד,שוויון בנטל,"לא כל צבא יכול להיות על בסיס של שוויון, זה יכול לגרום לפגיעות בכוח הלוחם.",מתנגד
דת ומדינה_מתנגד,שוויון בנטל,הדרישה לשוויון בנטל עלולה להיות על חשבון כישוריהם של אנשים מסוימים.,מתנגד
דת ומדינה_מתנגד,שוויון בנטל,יוזמות לשוויון בנטל לא לוקחות בחשבון את ההיסטוריה והתרבות של אוכלוסיות שונות.,מתנגד
דת ומדינה_נייטרלי,שוויון בנטל,שוויון בנטל הוא נושא שנמצא על סדר היום הציבורי בישראל.,נייטרלי
דת ומדינה_נייטרלי,שוויון בנטל,נראה כי לא כולם מסכימים על הדרך הנכונה לאזן את הנטל במדינה.,נייטרלי
דת ומדינה_נייטרלי,שוויון בנטל,יש אנשים המאמינים שצריך להעריך כל מקרה לגופו לפני שמקבלים החלטות בנושא זה.,נייטרלי
דת ומדינה_נייטרלי,שוויון בנטל,דעות שונות מתקבלות כאשר משוחחים על שאלת שוויון בנטל.,נייטרלי
דת ומדינה_נייטרלי,שוויון בנטל,"לשוויון בנטל יש השפעות רבות על החברה, אך הקונספט עצמו מורכב.",נייטרלי
דת ומדינה_נייטרלי,שוויון בנטל,העיסוק בשוויון בנטל מעורר שאלות רבות בקרב הציבור.,נייטרלי
דת ומדינה_נייטרלי,שוויון בנטל,נראה כי יש צורך לנהל דיון מעמיק יותר בנושא שוויון בנטל.,נייטרלי
דת ומדינה_נייטרלי,שוויון בנטל,"לאחרונה, נושאי שוויון בנטל זוכים לתשומת לב רבה בתקשורת.",נייטרלי
דת ומדינה_נייטרלי,שוויון בנטל,ההמלצות לשוויון בנטל הן חלק אינטגרלי מדיון על צדק חברתי.,נייטרלי
דת ומדינה_נייטרלי,שוויון בנטל,"שוויון בנטל אינו נדון רק במישור צבאי, אלא גם במובנים חברתיים וכלכליים.",נייטרלי
דת ומדינה_תומך,הפרדת דת ומדינה,הפרדת דת ומדינה היא הדרך הנכונה להבטיח חופש דת לכל האזרחים.,תומך
דת ומדינה_תומך,הפרדת דת ומדינה,"במדינה חילונית, כל התושבים יכולים לחיות בשקט ובשלום, בלי לחוש כפיה דתית.",תומך
דת ומדינה_תומך,הפרדת דת ומדינה,מערכת חינוך חופשית מדת מאפשרת לכל תלמיד למצוא את דרכו הרוחנית האישית.,תומך
דת ומדינה_תומך,הפרדת דת ומדינה,יש להפריד בין מוסדות דתיים למוסדות המדינה כדי למנוע אפליה.,תומך
דת ומדינה_תומך,הפרדת דת ומדינה,"כשהדת נפרדת מהמדינה, זה מסייע ביצירת חברה מגוונת וכבוד הדדי.",תומך
דת ומדינה_תומך,הפרדת דת ומדינה,הפרדת דת ומדינה תורמת לקידום זכויות נשים ושוויון.,תומך
דת ומדינה_תומך,הפרדת דת ומדינה,מדינה שללא דתיות חיובית מאפשרת שיח ביקורתי ופתוח על נושאים חשובים.,תומך
דת ומדינה_תומך,הפרדת דת ומדינה,החוק צריך להיות ניטרלי ולא נשלט על ידי עקרונות דתיים.,תומך
דת ומדינה_תומך,הפרדת דת ומדינה,הפרדה תאפשר לציבורים השונים להתקיים זה לצד זה מבלי עימותים.,תומך
דת ומדינה_תומך,הפרדת דת ומדינה,מדינה שמכבדת את הפרדת דת ומדינה משדרת מסר חיובי לסביבות בינלאומיות.,תומך
דת ומדינה_מתנגד,הפרדת דת ומדינה,הדת מספקת ערכים מוסריים חשובים שצריכים להיות חלק מהמדינה.,מתנגד
דת ומדינה_מתנגד,הפרדת דת ומדינה,הפרדת דת ומדינה עלולה להוביל לאובדן מורשת תרבותית ערך.,מתנגד
דת ומדינה_מתנגד,הפרדת דת ומדינה,"לדת יש תפקיד מרכזי בחיי היום-יום של רבים, ואסור להתעלם מכך.",מתנגד
דת ומדינה_מתנגד,הפרדת דת ומדינה,ביטול הקשרים בין דת למדינה עשוי להחליש את הרוח הקהילתית.,מתנגד
דת ומדינה_מתנגד,הפרדת דת ומדינה,המדינה לא יכולה להיות לגמרי ניטרלית כי חלק מהאזרחים מחוברים לדת.,מתנגד
דת ומדינה_מתנגד,הפרדת דת ומדינה,"הדת מביאה נחת ומשמעות לחיים, והמדינה חייבת להכיר בכך.",מתנגד
דת ומדינה_מתנגד,הפרדת דת ומדינה,"במדינות בהן יש הפרדה ברור בין דת למדינה, קיימת תחושת ניכור רבה.",מתנגד
דת ומדינה_מתנגד,הפרדת דת ומדינה,חוקי הדת מספקים מסגרת מוסרית שיכולה להנחות את המדינה.,מתנגד
דת ומדינה_מתנגד,הפרדת דת ומדינה,הקשר בין דת למדינה יכול להיות מועיל רבות להתפתחות חברתית.,מתנגד
דת ומדינה_מתנגד,הפרדת דת ומדינה,הפרדת דת ומדינה עלולה להביא לתסיסה וביקורת מצד הציבור הדתי.,מתנגד
דת ומדינה_נייטרלי,הפרדת דת ומדינה,דיון על הפרדת דת ומדינה מציף הרבה שאלות חשובות.,נייטרלי
דת ומדינה_נייטרלי,הפרדת דת ומדינה,הנושא נשקל על ידי אנשי ציבור ומומחים רבים.,נייטרלי
דת ומדינה_נייטרלי,הפרדת דת ומדינה,חלק מהאנשים רואים בנפרדות הזמנות חדשות לחיזוק החברה.,נייטרלי
דת ומדינה_נייטרלי,הפרדת דת ומדינה,"ישנם קולות בשיחה על השפעת הדת במדינה, אך לא כולם מסכימים.",נייטרלי
דת ומדינה_נייטרלי,הפרדת דת ומדינה,הדיון הזה מעלה שאלות על תחום השפעת התרבות על החיים הציבוריים.,נייטרלי
דת ומדינה_נייטרלי,הפרדת דת ומדינה,נראה כי הנושא לא חד משמעי וכולל מגוון דעות.,נייטרלי
דת ומדינה_נייטרלי,הפרדת דת ומדינה,יצירת קשרים בין דת למדינה היא סוגיה מורכבת שדורשת תשובות.,נייטרלי
דת ומדינה_נייטרלי,הפרדת דת ומדינה,במאמרים רבים עוסקים בהשלכות האפשריות של כל גישה להפרדה.,נייטרלי
דת ומדינה_נייטרלי,הפרדת דת ומדינה,"החברה הישראלית מורכבת מאוד, והפערים בין דתיים לחילוניים בולטים.",נייטרלי
דת ומדינה_נייטרלי,הפרדת דת ומדינה,המצב הנוכחי במדינה ממשיך לעורר שאלות רבות על עתיד הקשר בין דת למדינה.,נייטרלי
דת ומדינה_תומך,שמירת שבת במרחב הציבורי,"שבת היא יום המנוחה הקדוש, ולכן יש לשמור עליה גם במרחב הציבורי.",תומך
דת ומדינה_תומך,שמירת שבת במרחב הציבורי,שמירה על שבת במרחב הציבורי מבטאת כבוד למסורת ולתרבות היהודית.,תומך
דת ומדינה_תומך,שמירת שבת במרחב הציבורי,לסביבה ציבורית בת שיח ששומרת שבת יש ערך חינוכי חשוב לדור הצעיר.,תומך
דת ומדינה_תומך,שמירת שבת במרחב הציבורי,אכיפת שמירת שבת מאפשרת לתושבים לשמור על אורח חיים דתי.,תומך
דת ומדינה_תומך,שמירת שבת במרחב הציבורי,"כאשר המרחב הציבורי שומר שבת, הוא מהווה דוגמה חיובית לאחדות בקהילה.",תומך
דת ומדינה_תומך,שמירת שבת במרחב הציבורי,שמירה על שבת במרחב הציבורי יכולה לתרום להרגשה של קהילתיות בקרב תושבים.,תומך
דת ומדינה_תומך,שמירת שבת במרחב הציבורי,זה חיוני לפרסם את החשיבות של שמירת שבת עבור כל מי שחי בעיר.,תומך
דת ומדינה_תומך,שמירת שבת במרחב הציבורי,אנחנו צריכים לתמוך בשמירה על שבת כדי להבטיח שלא נשכח את ערכי המסורת.,תומך
דת ומדינה_תומך,שמירת שבת במרחב הציבורי,שמירה על שבת במרחבים ציבוריים מחזקת את זיקתנו למסורת היהודית.,תומך
דת ומדינה_תומך,שמירת שבת במרחב הציבורי,פעולות לשמירה על שבת במרחב הציבורי הן דבר חשוב ומועיל לחברה כולה.,תומך
דת ומדינה_מתנגד,שמירת שבת במרחב הציבורי,כפיית שמירת שבת במרחב הציבורי פוגעת בחופש האישית של אזרחים.,מתנגד
דת ומדינה_מתנגד,שמירת שבת במרחב הציבורי,מדינה דמוקרטית לא צריכה impose שמירת שבת על כלל האוכלוסייה.,מתנגד
דת ומדינה_מתנגד,שמירת שבת במרחב הציבורי,"לא כולם רואים בשבת יום מנוחה, ולכן אין טעם לאכוף את השמירה עליו.",מתנגד
דת ומדינה_מתנגד,שמירת שבת במרחב הציבורי,"שבת היא נושא אישי, וכל אדם צריך להחליט בעצמו אם לשמור עליה או לא.",מתנגד
דת ומדינה_מתנגד,שמירת שבת במרחב הציבורי,"המרחב הציבורי צריך להיות פתוח לכל, ולא להיבנות על סמך עקרונות דתיים.",מתנגד
דת ומדינה_מתנגד,שמירת שבת במרחב הציבורי,אכיפת שמירת שבת יכולה לגרום למתחים בין קבוצות שונות בתוך החברה.,מתנגד
דת ומדינה_מתנגד,שמירת שבת במרחב הציבורי,אין סיבה להפסיק את חיי הציבור בשבת כאשר יש אפשרויות לשמר את השקט גם ללא אכיפה.,מתנגד
דת ומדינה_מתנגד,שמירת שבת במרחב הציבורי,השמירה על שבת במרחב הציבורי מגבילה את חופש התנועה והפעולה של רבים.,מתנגד
דת ומדינה_מתנגד,שמירת שבת במרחב הציבורי,"באופן כללי, יש יותר מקומות לעודד חופש דת מאשר להגביל אותו.",מתנגד
דת ומדינה_מתנגד,שמירת שבת במרחב הציבורי,כל אזרח צריך להיות חופשי לחיות לפי אמונותיו ולא לפי כללים דתיים.,מתנגד
דת ומדינה_נייטרלי,שמירת שבת במרחב הציבורי,שמירת שבת במרחב הציבורי היא נושא מורכב שדורש דיון מעמיק.,נייטרלי
דת ומדינה_נייטרלי,שמירת שבת במרחב הציבורי,יש דעות שונות על השפעת שמירת שבת במקומות ציבוריים על החברה.,נייטרלי
דת ומדינה_נייטרלי,שמירת שבת במרחב הציבורי,חשוב לזהות את השיפוטיות שקשורה לשמירת שבת במרחב הציבורי.,נייטרלי
דת ומדינה_נייטרלי,שמירת שבת במרחב הציבורי,נראה כי לאנשים יש רגשות חזקים בנושא שמירת שבת במרחב הציבורי.,נייטרלי
דת ומדינה_נייטרלי,שמירת שבת במרחב הציבורי,דיון על נושא זה יכול להוביל להבנה מעמיקה יותר בין הקבוצות השונות.,נייטרלי
דת ומדינה_נייטרלי,שמירת שבת במרחב הציבורי,יתכן שעל העיריות למצוא פתרונות שיתאימו לכל האוכלוסייה בנושא הזה.,נייטרלי
דת ומדינה_נייטרלי,שמירת שבת במרחב הציבורי,הנושא מעורר שאלות על חופש דת וחופש פרט.,נייטרלי
דת ומדינה_נייטרלי,שמירת שבת במרחב הציבורי,על המדינה למצוא איזון בין המסורת לבין החירויות האישיות.,נייטרלי
דת ומדינה_נייטרלי,שמירת שבת במרחב הציבורי,האתגרים בשמירה על שבת במקומות ציבוריים מחייבים שיח פתוח.,נייטרלי
דת ומדינה_נייטרלי,שמירת שבת במרחב הציבורי,ישנן דעות חלוקות בנוגע לאופן שבו יש ליישם שמירה על שבת במרחבים ציבוריים.,נייטרלי
דת ומדינה_תומך,חינוך ממלכתי-דתי,חינוך ממלכתי-דתי מחבר בין ערכים רוחניים לערכים חינוכיים חשובים.,תומך
דת ומדינה_תומך,חינוך ממלכתי-דתי,מערכת החינוך הממלכתי-דתי מציעה לתלמידים כלים להתמודד עם האתגרים של החיים המודרניים.,תומך
דת ומדינה_תומך,חינוך ממלכתי-דתי,לימודים במסגרת דתית יכולים להקנות לתלמידים זהות חזקה וברורה.,תומך
דת ומדינה_תומך,חינוך ממלכתי-דתי,המורים בחינוך הממלכתי-דתי משלבים ידע דתי עם גישות חינוכיות מתקדמות.,תומך
דת ומדינה_תומך,חינוך ממלכתי-דתי,החינוך הממלכתי-דתי מספק סביבה תומכת שבה ילדים יכולים לצמוח וללמוד.,תומך
דת ומדינה_תומך,חינוך ממלכתי-דתי,בתי ספר ממלכתיים-דתיים מאפשרים לאמא ואבא לשתף פעולה בחינוך ילדיהם.,תומך
דת ומדינה_תומך,חינוך ממלכתי-דתי,החינוך הממלכתי-דתי מדגיש את חשיבות המסגרת הקהילתית והמשפחתית.,תומך
דת ומדינה_תומך,חינוך ממלכתי-דתי,בסיס חינוכי דתי יכול להעניק לתלמידים מורה דרך משמעותי בחיים.,תומך
דת ומדינה_תומך,חינוך ממלכתי-דתי,חינוך ממלכתי-דתי מספק גישה הומניסטית עם ליבת ערכים יהודיים.,תומך
דת ומדינה_תומך,חינוך ממלכתי-דתי,התנסויות חינוכיות בתוך המסגרת הממלכתית-דתית עשויות להיות מעצימות ומעשירות.,תומך
דת ומדינה_מתנגד,חינוך ממלכתי-דתי,חינוך ממלכתי-דתי עלול להגביל את החופש האישי של התלמידים לבחור את דרכם.,מתנגד
דת ומדינה_מתנגד,חינוך ממלכתי-דתי,ההשפעה של דת על החינוך יכולה למנוע גישה מגוונת לידע.,מתנגד
דת ומדינה_מתנגד,חינוך ממלכתי-דתי,צעירים זקוקים למערכות חינוך שממקדדות ראיה רחבה ולא מגבילות.,מתנגד
דת ומדינה_מתנגד,חינוך ממלכתי-דתי,חינוך דתי קונסטרוקטיבי יכול להוביל לפיתוח עמדות לסבירות כלפי דתות אחרות.,מתנגד
דת ומדינה_מתנגד,חינוך ממלכתי-דתי,חינוך ממלכתי-דתי מספק פתרונות שטחיים שאינם מתאימים לכל התלמידים.,מתנגד
דת ומדינה_מתנגד,חינוך ממלכתי-דתי,הדגש על חינוך דתי עשוי להחמיץ נושאים חשובים כגון מדע וחשיבה ביקורתית.,מתנגד
דת ומדינה_מתנגד,חינוך ממלכתי-דתי,חינוך ממלכתי-דתי עשוי להוביל לקריכוש ולניכור של תלמידים שאינם שותפים לערכים.,מתנגד
דת ומדינה_מתנגד,חינוך ממלכתי-דתי,יש המאמינים כי חינוך ממלכתי-דתי יוצר סביבה פחות סובלנית לשונות תרבותית.,מתנגד
דת ומדינה_מתנגד,חינוך ממלכתי-דתי,ישנה תחושה שחינוך זה מפלה בין תלמידים על פי השקפת עולמם הדתית.,מתנגד
דת ומדינה_מתנגד,חינוך ממלכתי-דתי,לא ניתן לתת יחס שווה לכל הילדים בחינוך ממלכתי-דתי אם יש דגש כה משמעותי על הדת.,מתנגד
דת ומדינה_נייטרלי,חינוך ממלכתי-דתי,חינוך ממלכתי-דתי קיים בישראל ומשרת אוכלוסיות שונות.,נייטרלי
דת ומדינה_נייטרלי,חינוך ממלכתי-דתי,בבתי ספר ממלכתיים-דתיים לומדים תלמידים ממגוון דעות והיסטוריות.,נייטרלי
דת ומדינה_נייטרלי,חינוך ממלכתי-דתי,חלק מההורים בוחרים לשלוח את ילדיהם לחינוך ממלכתי-דתי מסיבות שונות.,נייטרלי
דת ומדינה_נייטרלי,חינוך ממלכתי-דתי,המערכת החינוכית בישראל כוללת מסגרות דתיות לצד מסגרות חילוניות.,נייטרלי
דת ומדינה_נייטרלי,חינוך ממלכתי-דתי,בבתי ספר ממלכתיים-דתיים מועברים תכנים שונים בתחום הלימודים.,נייטרלי
דת ומדינה_נייטרלי,חינוך ממלכתי-דתי,"ישנם פערים בין בתי ספר דתיים ובין בתי ספר ממלכתיים, ואין זה מובן מאליו.",נייטרלי
דת ומדינה_נייטרלי,חינוך ממלכתי-דתי,"עבור הרבה תלמידים, חינוך ממלכתי-דתי הוא חלק מהותי בחייהם.",נייטרלי
דת ומדינה_נייטרלי,חינוך ממלכתי-דתי,קיום השכלה דתית במערכת הממלכתית מעורר דיון ציבורי.,נייטרלי
דת ומדינה_נייטרלי,חינוך ממלכתי-דתי,כל משפחה בוחרת את המסלול החינוכי שמתאים לה ביותר.,נייטרלי
דת ומדינה_נייטרלי,חינוך ממלכתי-דתי,חינוך ממלכתי-דתי מתמודד עם אתגרים שונים במאה ה-21.,נייטרלי
דת ומדינה_תומך,כשרות במסעדות,כשרות במסעדות חשובה מאוד לשמירה על המסורת היהודית.,תומך
