Topic,Sub-topic,Text,Stance
כלכלה וחברה_נייטרלי,צמצום פערים,עלות תכניות לצמצום פערים נבחנת מעת לעת.,נייטרלי
כלכלה וחברה_נייטרלי,צמצום פערים,בקהילות שונות יש תחושות שונות לגבי צמצום פערים.,נייטרלי
כלכלה וחברה_נייטרלי,צמצום פערים,נראה כי נושא הפערים סביבו יש לעודד יותר מחקרים.,נייטרלי
כלכלה וחברה_נייטרלי,צמצום פערים,חשוב להיות פתוחים לדעות שונות בנושא צמצום פערים.,נייטרלי
כלכלה וחברה_תומך,אבטלה,אבטלה היא בעיה חמורה שיש להתמודד איתה במדינתנו.,תומך
כלכלה וחברה_תומך,אבטלה,תוכנית כלכלית שתומכת בהעסקה יכולה לצמצם את האבטלה בצורה משמעותית.,תומך
כלכלה וחברה_תומך,אבטלה,כל אדם שמאבד את עבודתו זקוק לעזרה עם אבטלה.,תומך
כלכלה וחברה_תומך,אבטלה,"אבטלה גורמת לבעיות חברתיות רבות, ולכן יש לעודד תעסוקה.",תומך
כלכלה וחברה_תומך,אבטלה,המדינה צריכה להשקיע יותר במנגוני סיוע לאנשים חסרי עבודה.,תומך
כלכלה וחברה_תומך,אבטלה,אבטלה לא פוגעת רק בפרטים אלא גם בכלכלה כולה.,תומך
כלכלה וחברה_תומך,אבטלה,יש צורך בגישה כוללת לפתרון בעיית האבטלה.,תומך
כלכלה וחברה_תומך,אבטלה,תוכניות הכשרה מקצועית עשויות לצמצם את אחוזי האבטלה.,תומך
כלכלה וחברה_תומך,אבטלה,צמצום האבטלה הוא חיוני להתפתחות מדינה מתקדמת.,תומך
כלכלה וחברה_תומך,אבטלה,התחלת יוזמות חדשות ליצירת מקומות עבודה יכולה לשפר את המצב.,תומך
כלכלה וחברה_מתנגד,אבטלה,"לאבטלה יש גם צדדים חיוביים, כמו הזדמנויות לחשיבה מחדש על קריירה.",מתנגד
כלכלה וחברה_מתנגד,אבטלה,"האבטלה איננה תמיד בעיה, לעיתים אנשים מעדיפים להישאר בין עבודות.",מתנגד
כלכלה וחברה_מתנגד,אבטלה,ישנם אנשים שמוצאים יתרון בזמן האבטלה על ידי פיתוח כישורים חדשים.,מתנגד
כלכלה וחברה_מתנגד,אבטלה,"בדרך כלל, אבטלה זמנית לא מזיקה ומאפשרת חזרה לשוק העבודה עם חוזק.",מתנגד
כלכלה וחברה_מתנגד,אבטלה,האבטלה עשויה להיות יתרון בשוק העבודה כשהיא מאפשרת ביקוש גבוה יותר לעובדים.,מתנגד
כלכלה וחברה_מתנגד,אבטלה,יש מדינות שבהן רמות האבטלה גבוהות אבל הכלכלה משגשגת.,מתנגד
כלכלה וחברה_מתנגד,אבטלה,"לא תמיד אבטלה היא תוצאה של מצב כלכלי רע, לפעמים מדובר בצמיחה טבעית.",מתנגד
כלכלה וחברה_מתנגד,אבטלה,לפעמים אבטלה מספקת זמן להמיתכונן למשרות טובות יותר בעתיד.,מתנגד
כלכלה וחברה_מתנגד,אבטלה,יש מי שטוענים שהפער בין הכישורים למקצועות הנדרשים יכול להוביל לאבטלה.,מתנגד
כלכלה וחברה_מתנגד,אבטלה,יש אנשים שמעדיפים לקחת הפסקה מעבודה כדי לחוות פחדים ולגלות כיוונים חדשים.,מתנגד
כלכלה וחברה_נייטרלי,אבטלה,בארץ יש מערכות שונות לטיפול באנשים במצב של אבטלה.,נייטרלי
כלכלה וחברה_נייטרלי,אבטלה,אבטלה קשורה באופן ישיר למצב הכלכלה והדרישות בשוק העבודה.,נייטרלי
כלכלה וחברה_נייטרלי,אבטלה,חלק מהאנשים נמצאים בהשקפת עולם שבה עבודה אינה מטרה מרכזית.,נייטרלי
כלכלה וחברה_נייטרלי,אבטלה,סוגיות תעסוקה נוגעות למספר המועסקים במשק.,נייטרלי
כלכלה וחברה_נייטרלי,אבטלה,שאילתות על אבטלה מופיעות בכל דיון על רווחה כלכלית.,נייטרלי
כלכלה וחברה_נייטרלי,אבטלה,מחקרים בתחום האבטלה עוסקים באספקטים שונים של התמחות ושוק העבודה.,נייטרלי
כלכלה וחברה_נייטרלי,אבטלה,תופעת האבטלה מושפעת גם מהמגבלות החינוכיות הקיימות היום.,נייטרלי
כלכלה וחברה_נייטרלי,אבטלה,מדי פעם מדווחים על ירידה או עלייה באחוזי האבטלה במדינה.,נייטרלי
כלכלה וחברה_נייטרלי,אבטלה,המצב בשוק העבודה משתנה בעקביות ולכן יש צורך לבדוק נתונים מעודכנים.,נייטרלי
כלכלה וחברה_נייטרלי,אבטלה,"במקרים מסוימים, יש אנשים המחליטים לעזוב את מקום עבודתם מבלי לחשוש מאבטלה.",נייטרלי
כלכלה וחברה_תומך,צמצום בירוקרטיה,צמצום הבירוקרטיה יכול להקל על אזרחים ולחסוך להם זמן יקר.,תומך
כלכלה וחברה_תומך,צמצום בירוקרטיה,"באמצעות צמצום הבירוקרטיה, ניתן לייעל תהליכים ובכך לשפר את השירות הציבורי.",תומך
כלכלה וחברה_תומך,צמצום בירוקרטיה,פשוט אין סיבה שהממשל יסבך את חייו של האזרח בפורמלים לא נחוצים.,תומך
כלכלה וחברה_תומך,צמצום בירוקרטיה,צמצום בירוקרטיה עשוי לעודד יזמות ולעזור לעסקים קטנים להתפתח.,תומך
כלכלה וחברה_תומך,צמצום בירוקרטיה,"כאשר הבירוקרטיה מצטמצמת, אנשים יכולים להתמקד במה שחשוב באמת ולא בניירות.",תומך
כלכלה וחברה_תומך,צמצום בירוקרטיה,החיסכון בזמן שניתן להשיג על ידי צמצום הבירוקרטיה הוא הכרחי בעידן המודרני.,תומך
כלכלה וחברה_תומך,צמצום בירוקרטיה,ממשלות צריכות לפשט את תהליכי קבלת ההחלטות כדי לשרת את הציבור טוב יותר.,תומך
כלכלה וחברה_תומך,צמצום בירוקרטיה,מדינות שמשקיעות בצמצום הבירוקרטיה רואות בדרך כלל עלייה באופטימיות אזרחית.,תומך
כלכלה וחברה_תומך,צמצום בירוקרטיה,צמצום הבירוקרטיה הוא צעד חשוב לקראת שיפור השקיפות והשירות הציבורי.,תומך
כלכלה וחברה_תומך,צמצום בירוקרטיה,יותר אנשים ירגישו נוח להתחיל תהליכים אם הבירוקרטיה תהיה פחות מעיקה.,תומך
כלכלה וחברה_מתנגד,צמצום בירוקרטיה,צמצום הבירוקרטיה עלול לגרום לפגיעות באיכות השירותים הציבוריים.,מתנגד
כלכלה וחברה_מתנגד,צמצום בירוקרטיה,ביטול גבולות בירוקרטיים מסוימים עשוי להוביל לאנרכיה וחוסר סדר.,מתנגד
כלכלה וחברה_מתנגד,צמצום בירוקרטיה,חשוב שהבירוקרטיה תהא קיימת כדי למנוע מעילות ושחיתויות.,מתנגד
כלכלה וחברה_מתנגד,צמצום בירוקרטיה,"איומית בירוקרטית היא לא רק מכשול, אלא גם אמצעי להגנה על זכויות האזרח.",מתנגד
כלכלה וחברה_מתנגד,צמצום בירוקרטיה,צמצום הבירוקרטיה עלול להזיק לפיקוח הנדרש בתחום הבריאות הציבורית.,מתנגד
כלכלה וחברה_מתנגד,צמצום בירוקרטיה,בירוקרטיה מסוימת נדרשת כדי לוודא שאנשים שאינם זכאים לא ייהנו מהשירותים.,מתנגד
כלכלה וחברה_מתנגד,צמצום בירוקרטיה,"ללא בירוקרטיה מספקת, יש חשש לאובדניות ולזניחת מוסדות ציבוריים חשובים.",מתנגד
כלכלה וחברה_מתנגד,צמצום בירוקרטיה,צמצום בירוקרטיה עלול לפגוע באלה הזקוקים להגנה ובאספקת שירותים לציבור.,מתנגד
כלכלה וחברה_מתנגד,צמצום בירוקרטיה,"בזמן שצמצום בירוקרטיה נשמע חיובי, במקרים מסוימים הוא עלול לסכן את הציבור.",מתנגד
כלכלה וחברה_מתנגד,צמצום בירוקרטיה,"לפעמים, נהלים בירוקרטיים עשויים להיראות מסורבלים, אך הם הכרחיים למאבק במצבים מסוימים.",מתנגד
כלכלה וחברה_נייטרלי,צמצום בירוקרטיה,הנושא של צמצום בירוקרטיה עולה לעיתים קרובות בדיונים ציבוריים.,נייטרלי
כלכלה וחברה_נייטרלי,צמצום בירוקרטיה,יש הרבה דעות שונות לגבי היתרונות והחסרונות של בירוקרטיה.,נייטרלי
כלכלה וחברה_נייטרלי,צמצום בירוקרטיה,"צמצום בירוקרטיה יכול להשתמע בחיוב או בשלילה, בהתאם לזווית הראייה של כל אחד.",נייטרלי
כלכלה וחברה_נייטרלי,צמצום בירוקרטיה,"יש אנשים המאמינים שנדרשת בירוקרטיה כדי לשמור על סדר, אחרים טוענים שהיא מכבידה.",נייטרלי
כלכלה וחברה_נייטרלי,צמצום בירוקרטיה,הדיון על צמצום הבירוקרטיה רלוונטי בכל הקשור לעבודת הממשלה.,נייטרלי
כלכלה וחברה_נייטרלי,צמצום בירוקרטיה,כל הנוגע לבירוקרטיה מעורר שאלות רבות בנוגע ליעילותה.,נייטרלי
כלכלה וחברה_נייטרלי,צמצום בירוקרטיה,נראה כי הנושא של בירוקרטיה מלווה את החברה הרבה שנים.,נייטרלי
כלכלה וחברה_נייטרלי,צמצום בירוקרטיה,יש מי שמרגיש שהבירוקרטיה היא חלק בלתי נפרד מחוויית השירות הציבורי.,נייטרלי
כלכלה וחברה_נייטרלי,צמצום בירוקרטיה,לאחרונה נשמעו קריאות רבות לצמצם את הבירוקרטיה במגוון תחומים.,נייטרלי
כלכלה וחברה_נייטרלי,צמצום בירוקרטיה,חוקרים מצביעים על כך שהבירוקרטיה יכולה לשמש כקנה מידה לערכים חברתיים.,נייטרלי
כלכלה וחברה_תומך,תעשיות הייטק,התעשיות של ההייטק מספקות למעלה מאלף משרות חדשות בכל חודש.,תומך
כלכלה וחברה_תומך,תעשיות הייטק,ההייטק מגדיל את הכלכלה המקומית ומביא השקעות זרות רבות.,תומך
כלכלה וחברה_תומך,תעשיות הייטק,כישרונות צעירים נמשכים לתחום ההייטק בזכות התנאים הטובים והחדשנות.,תומך
כלכלה וחברה_תומך,תעשיות הייטק,חברות ההייטק משקיעות רבות במו,תומך
כלכלה וחברה_מתנגד,תעשיות הייטק,תעשיית ההייטק מלווה בזעזועים כלכליים ושינויים תכופים בשוק העבודה.,מתנגד
כלכלה וחברה_מתנגד,תעשיות הייטק,כישרונות רבים עוזבים את התחום בעקבות שעות העבודה הארוכות והלחץ המוגזם.,מתנגד
כלכלה וחברה_מתנגד,תעשיות הייטק,ההייטק לא מצליח להתמודד עם בעיות האי שוויון החברתי בישראל.,מתנגד
כלכלה וחברה_מתנגד,תעשיות הייטק,"לא כל האנשים מתאימים ליוקרה ולתנאים של תעשיית ההייטק, וזה גורם להדרה.",מתנגד
כלכלה וחברה_מתנגד,תעשיות הייטק,חלק מהחברות מההייטק נוטות להתמקד ברווחים במקום באחריות חברתית.,מתנגד
כלכלה וחברה_מתנגד,תעשיות הייטק,שכר גבוה לא תמיד מתורגם לשביעות רצון עבודה של העובדים בתעשייה.,מתנגד
כלכלה וחברה_מתנגד,תעשיות הייטק,יש חשש שמוקדי ההייטק יגרמו לאי יציבות בשוק עם עובדים עניים.,מתנגד
כלכלה וחברה_מתנגד,תעשיות הייטק,"התעשייה תופסת יותר מידי מקום בשוק העבודה, תוך פגיעה במקצועות אחרים.",מתנגד
כלכלה וחברה_מתנגד,תעשיות הייטק,תהליכי הקלה והסרות רגולציה על עבודת ההייטק עלולים לפגוע בעצמאות העובדים.,מתנגד
כלכלה וחברה_מתנגד,תעשיות הייטק,חלק מההייטק בישראל לא מייצר ערך מוסף אמיתי לחברה.,מתנגד
כלכלה וחברה_נייטרלי,תעשיות הייטק,תעשיות ההייטק הן מגזר חשוב בכלכלה העולמית.,נייטרלי
כלכלה וחברה_נייטרלי,תעשיות הייטק,"ישנם יתרונות וחסרונות לעבודה בהייטק, תלוי בעדיפויות האישיות.",נייטרלי
כלכלה וחברה_נייטרלי,תעשיות הייטק,העתיד של תעשיית ההייטק נמצא במרכז הדיונים הציבוריים.,נייטרלי
כלכלה וחברה_נייטרלי,תעשיות הייטק,"חברות רבות בהייטק עוסקות בתחומים שונים, כמו פינטק ובריאות.",נייטרלי
כלכלה וחברה_נייטרלי,תעשיות הייטק,תעשיית ההייטק רשומה על גידול מתמיד באוכלוסיית המהנדסים.,נייטרלי
כלכלה וחברה_נייטרלי,תעשיות הייטק,קיימת מגמה של פיתוח טכנולוגיות סביבתיות על ידי חברות הייטק.,נייטרלי
כלכלה וחברה_נייטרלי,תעשיות הייטק,"נכון להיום, קשה לחזות את הכיוונים שבהם תתפתח תעשיית ההייטק.",נייטרלי
כלכלה וחברה_נייטרלי,תעשיות הייטק,שיעורי התעסוקה גבוהה במיוחד במקצועות הטכנולוגיים.,נייטרלי
כלכלה וחברה_נייטרלי,תעשיות הייטק,ישנם דיונים בשוק על האתיקה של החדשנות בהייטק.,נייטרלי
כלכלה וחברה_נייטרלי,תעשיות הייטק,השפעת ההייטק על עולם העבודה המודרני היא נושא מרתק.,נייטרלי
כלכלה וחברה_תומך,מכסות יבוא,מכסות יבוא יכולות לעזור בהגנה על התעשיות המקומיות.,תומך
כלכלה וחברה_תומך,מכסות יבוא,שמירה על מכסות יבוא מבטיחה שלטון על איכות המוצרים בשוק.,תומך
כלכלה וחברה_תומך,מכסות יבוא,הגבלת מכסות יבוא יכולה לחזק את הכלכלה המקומית.,תומך
כלכלה וחברה_תומך,מכסות יבוא,מכסות יבוא תומכות בהגדלת התעסוקה במפעלים המקומיים.,תומך
כלכלה וחברה_תומך,מכסות יבוא,באמצעות מכסות ממיינות אנחנו מאפשרים לצרכנים לבחור מוצרים איכותיים יותר.,תומך
כלכלה וחברה_תומך,מכסות יבוא,מכסות יבוא עשויות לסייע לשמור על מחירים סבירים בשוק.,תומך
כלכלה וחברה_תומך,מכסות יבוא,תכנון נכון של מכסות יבוא יכול למנוע בעיות של הצפת שוק.,תומך
כלכלה וחברה_תומך,מכסות יבוא,הגבלות בייבוא הן צעד חיוני לשמירה על התוצרת החקלאית המקומית.,תומך
כלכלה וחברה_תומך,מכסות יבוא,מדינות רבות כבר אימצו מכסות יבוא כדי לשמור על האינטרסים הכלכליים שלהן.,תומך
כלכלה וחברה_תומך,מכסות יבוא,ישנו קונצנזוס בקרב מומחים שהמדינה חייבת לשקול מכסות יבוא בתכנון כלכלי.,תומך
כלכלה וחברה_מתנגד,מכסות יבוא,מכסות יבוא פוגעות בתחרות החופשית ועלולות להעלות מחירים לצרכנים.,מתנגד
כלכלה וחברה_מתנגד,מכסות יבוא,הגבלת יבוא מפריעה לזרימה החופשית של סחר בינלאומי.,מתנגד
כלכלה וחברה_מתנגד,מכסות יבוא,מדיניות של מכסות יבוא יכולה לגרום למפגעים כלכליים בטווח הארוך.,מתנגד
כלכלה וחברה_מתנגד,מכסות יבוא,מכסות יבוא יוצרות קיפאון בשוק ומונעות חדשנות.,מתנגד
כלכלה וחברה_מתנגד,מכסות יבוא,הסיכוי למחסור במוצרים עולה כאשר יש מגבלות על יבוא.,מתנגד
כלכלה וחברה_מתנגד,מכסות יבוא,תעשיות מסוימות נפגעות מהמגבלות שמביאות מכסות יבוא.,מתנגד
כלכלה וחברה_מתנגד,מכסות יבוא,אין הוכחה מוצקה לכך שמכסות יבוא מסייעות בהגנה על הכלכלה המקומית.,מתנגד
כלכלה וחברה_מתנגד,מכסות יבוא,רעיון מכסות היבוא משקף חוסר הבנה של כלכלה גלובלית.,מתנגד
כלכלה וחברה_מתנגד,מכסות יבוא,מכסות יבוא הן צעד אחורה במדיניות כלכלית מודרנית.,מתנגד
כלכלה וחברה_מתנגד,מכסות יבוא,ביטול מכסות יבוא יכול לפתח את השוק ולמנוע בעיות עתידיות.,מתנגד
כלכלה וחברה_נייטרלי,מכסות יבוא,ישנן דעות שונות לגבי השפעת מכסות יבוא על המשק.,נייטרלי
כלכלה וחברה_נייטרלי,מכסות יבוא,מכסות יבוא הן נושא שנוי במחלוקת בקרב כלכלנים.,נייטרלי
כלכלה וחברה_נייטרלי,מכסות יבוא,הגענו למסקנה שנדרשה מדיניות מסוימת בתחום יבוא המוצרים.,נייטרלי
כלכלה וחברה_נייטרלי,מכסות יבוא,העתיד של מכסות יבוא תלוי במדיניות הכלכלית של המדינה.,נייטרלי
כלכלה וחברה_נייטרלי,מכסות יבוא,ניתוח מעמיק יכול לעזור להבין את התוצאות של מכסות יבוא.,נייטרלי
כלכלה וחברה_נייטרלי,מכסות יבוא,ישנם יתרונות וחסרונות למערכת מכסות יבוא שראוי לשקול.,נייטרלי
כלכלה וחברה_נייטרלי,מכסות יבוא,"שוק היבוא משתנה כל הזמן, וכדאי לעקוב אחרי המגמות.",נייטרלי
כלכלה וחברה_נייטרלי,מכסות יבוא,נראה כי העולם העסקי מגיב לשינויים במדיניות היבוא.,נייטרלי
כלכלה וחברה_נייטרלי,מכסות יבוא,כדאי לבחון את המדיניות הנוכחית לגבי מכסות יבוא באופן מעמיק יותר.,נייטרלי
כלכלה וחברה_נייטרלי,מכסות יבוא,"הדיונים על מכסות יבוא מתמשכים, ותחום זה זקוק לעדכון מתמיד.",נייטרלי
כלכלה וחברה_תומך,מס עשירים,מס עשירים יכול להקטין את הפערים החברתיים במדינה.,תומך
כלכלה וחברה_תומך,מס עשירים,הטלת מס על העשירים יכולה לספק מקורות כסף לשירותים ציבוריים.,תומך
כלכלה וחברה_תומך,מס עשירים,אני מאמין שיותר מסים על העשירים יכולים לתמוך בפרויקטים של חינוך ובריאות.,תומך
כלכלה וחברה_תומך,מס עשירים,עלינו לדאוג לצמצם את העושר לאנשים מסוימים כדי להבטיח חברה שוויונית יותר.,תומך
כלכלה וחברה_תומך,מס עשירים,מס עשירים יכול לעזור במאבק בעוני ולהעניק תקווה למי שזקוק לה.,תומך
כלכלה וחברה_תומך,מס עשירים,הכנסות ממס עשירים יכולות לשפר את התשתיות בעיר.,תומך
כלכלה וחברה_תומך,מס עשירים,גיוס כספים מהעשירים יעזור לקדם תוכניות חברתיות משמעותיות.,תומך
כלכלה וחברה_תומך,מס עשירים,מס עשירים מאפשר למדינה להשקיע יותר ברווחה של כלל הציבור.,תומך
כלכלה וחברה_תומך,מס עשירים,תמיכה במיסוי עשירים עשויה לעודד את העשירים לתמוך ביוזמות חברתיות.,תומך
כלכלה וחברה_תומך,מס עשירים,המס הזה יכול לשדר מסר חזק על צדק כלכלי.,תומך
כלכלה וחברה_מתנגד,מס עשירים,מס עשירים עלול להרתיע אנשים מכדי להשקיע או לפתוח עסקים.,מתנגד
כלכלה וחברה_מתנגד,מס עשירים,העלאת מיסים עשויה לפגוע בכלכלה ולגרום לירידה בהשקעות.,מתנגד
כלכלה וחברה_מתנגד,מס עשירים,"אני חושב שזוהי גזירה שאינה צודקת כלפי העשירים, שתרם בפיתוח הכלכלה.",מתנגד
כלכלה וחברה_מתנגד,מס עשירים,המס הזה יכול להוביל לבריחה של עשירים מהארץ.,מתנגד
כלכלה וחברה_מתנגד,מס עשירים,יש לכך השלכות שליליות על המוטיבציה של אנשים להצליח.,מתנגד
כלכלה וחברה_מתנגד,מס עשירים,גיוס כספים ממס עשירים לא בהכרח פותר בעיות חברתיות.,מתנגד
כלכלה וחברה_מתנגד,מס עשירים,המס עשירים עשוי להעמיק את תחושת הקיפוח בקרב בעלי ההון.,מתנגד
כלכלה וחברה_מתנגד,מס עשירים,לא ניתן להסתמך על מס עשירים כדי לשפר את מצבה של הכלכלה.,מתנגד
כלכלה וחברה_מתנגד,מס עשירים,העיקרון של מיסוי עשירים לא תואם את ערכי החירות האישית.,מתנגד
כלכלה וחברה_מתנגד,מס עשירים,מיסוי גבוה מסכן את מעמדה של ישראל כמדינה אטרקטיבית להשקעות.,מתנגד
כלכלה וחברה_נייטרלי,מס עשירים,מס עשירים הוא נושא שנמצא בליבת השיח הכלכלי כיום.,נייטרלי
כלכלה וחברה_נייטרלי,מס עשירים,יש מגוון דעות על ההשפעה של מיסוי על העשירים.,נייטרלי
כלכלה וחברה_נייטרלי,מס עשירים,חשוב להבין את ההשלכות של מס עשירים על הציבור הרחב.,נייטרלי
כלכלה וחברה_נייטרלי,מס עשירים,נראה שהשאלה האם להטיל מס עשירים מעסיקה רבים.,נייטרלי
כלכלה וחברה_נייטרלי,מס עשירים,בעולם יש דוגמאות שונות להטלת מסים על עשירים ואת התוצאות שלהן.,נייטרלי
כלכלה וחברה_נייטרלי,מס עשירים,בקרב הציבור יש דעות חלוקות על המס הזה.,נייטרלי
כלכלה וחברה_נייטרלי,מס עשירים,הנושא של מס עשירים כולל הרבה היבטים כלכליים וחברתיים.,נייטרלי
כלכלה וחברה_נייטרלי,מס עשירים,יש המאמינים שיכולות להיות יתרונות ומגרעות למיסוי עשירים.,נייטרלי
כלכלה וחברה_נייטרלי,מס עשירים,בדיונים על נושא זה עולות שאלות רבות על צדק כלכלי.,נייטרלי
כלכלה וחברה_נייטרלי,מס עשירים,יש הרואים את טיוטות החוק על המיסוי כהזדמנות לדיון מעמיק.,נייטרלי
כלכלה וחברה_תומך,מונופולים,מונופולים יכולים להבטיח יציבות כלכלית בשוק מסוים.,תומך
כלכלה וחברה_תומך,מונופולים,"כאשר חברה אחת שולטת בשוק, היא יכולה להשקיע יותר בפיתוח מוצרים חדשים.",תומך
